title,company,description,location
Data Analyst,integrated resources inc iri,data analyst project role looking inidual work collaboratively company team members strong analytical communication skills someone comfortable unix cloud environment basic scripting skills help us review existing cnical datasets load cnical graph data platform education bachelor degree one related fields data science computer science information systems equivalent work related experience required skills experience data analyst data curator experience python scripting experience data wrangng pre processing handng large datasets exquisite attention detail data analyst responsible maintaining healthy datasets document ensure high degree quaty control maintained flexible adaptable able learn quickly work various engagements excellent communication advanced engsh reading writing stening speaking skills nice skills experience working pharma medical biotech industries skills keywords education skills experience required skills data analyst python scripting data science datasets additional skills dtd html microsoft word quality control unix word languages engsh read write speak minimum degree required bachelor degree patents pubcations veteran status job description document uploaded request parsed skills experience section request based content file data analyst ecd pdf positions location mississauga mississauga road schede start date estimated end date hours per week hours per day,"Mississauga, Ontario, Canada"
Data Engineer,brp,brp looking data engineer join team bring analytics practice next level looking motivated person thrives dynamic challenging environment loves working tools edge problem switching mtiple programming languages able find box solutions solve complex problems role heart definition implementation world class analytics solutions contribute set data strategic advantage brp key responsibitiesdesign develop implement support robust etl elt data pipening solutionscoordinate mtiple development teams achieve devery objectivesprovide support requirements definition estimation development devery robust scalable solutionsdevelopment support real time data ingestion processes various data sourcesdevelopment support data models optimized business intelgence usagebuild integrations apis external providers google facebook salesforce sap othersadhering industry standards laws gdpr soxbe leader best practices definition creative thinkingyour quafications skillsmaster degree business intelgence equivalentsod demonstrated experience following technologies snowflake dbt talend azure data factory microsoft sql server power bifluent various programming languages sql python javascript node js javaunderstands puts practice data modeng design development sod etl elt data pipenesfluent writing executing optimizing complex sql queriesexperience implementing api service architectures rest develop clean maintainable code ci cd environmentexperience using cloud bi technologies azure similarexperience translating business requirements advanced data models able ffill analysts data scientists requirementsexperience data profingexperience working within agile team build big data analytics solutionsstrong interpersonal relations motivated loves work mtiple challenging projectsstrong communication skills speaking writingfluent french engshopen minded able adapt new ways working data vat event driven architecture unstructured data self service analytics etc well organized able self prioritize sometimes confctual deadnesstrong communication skills speaking writing french engshcontinuously seeks improvements craves put hands new technologieswelcome brpwe world leader recreational vehicles boats creating innovative ways move snow water asphalt dirt even air headquartered canadian town valcourt quebec company rooted spirit ingenuity intense customer focus today operate manufacturing facities canada united states mexico finland austraa austria workforce spirited people driven deeply held beef work fe destination journey,Greater Montreal Metropolitan Area
Data Analyst,alstom,leading societies low carbon future alstom develops markets mobity solutions provide sustainable foundations future transportation product portfoo ranges high speed trains metros monorail trams integrated systems customised services infrastructure signalng digital mobity solutions joining us means joining caring responsible innovative company people lead way greener smarter mobity worldwidepurpose joblead development deployment next generation data driven solutions mobity within lean startup pathway collaboration engineering mobity experts key accountabities design technical solution data driven approach including engineering financial impacts build feature extraction model programming build learning models including unsupervised predictive models simation tool assess enhance data quaty incoming data model responses apply data management practices build report explanatory materials share engineering experts apply strong testing quaty assurance practices design scalable data model including sql nosql modeng build customizable analytical dashboards serve key user maximo support planning department experience years digital companies software startups extensive practice data processing software development using java c years experience end end business solutions power apps years experience data visuazation software power bi experience data modelng experience database management sql experience erp software maximo sapcompetencies skills proven track record designing stable solution testing debugging demonstrated teamwork collaboration professional setting knowledge artificial intelgence machine learning algorithms proven capabities worldwide teams fluent engsh alstom leading company mobity sector solving interesting challenges tomorrow mobity value inquisitive innovative people passionate working together reinvent mobity making smarter sustainable day day building agile inclusive responsible cture erse group people offered opportunities learn grow advance careers options across functions geographic locations ready join try international community great people challenging journey tangible impact purpose equal opportunity statement alstom equal opportunity employer committed creating inclusive working environment employees encouraged reach fl potential inidual differences valued respected quafied appcants considered employment without regard race colour region gender sexual orientation gender identity age national origin disabity status characteristic protected local law job type experienced,"Toronto, Ontario, Canada"
Data Analyst (contract),tundra technical solutions,data analyst erp start immediatelyend march st type part time days week hour day position termthe data conversion analyst work stakeholders various business units across translink enterprise related suppers define document data related business processes requirements one technical enablement related projects initiatives constations data analyst review user stories ensure business data needs met via data conversion data migration work stream data analyst also participate support lead key aspects implementation finance supply chain technology solutions may include data analysis identifying gaps solution design development communications testing devery training work product require use productivity tools capture present project information including excel pivot tables charts sharepoint lists visio diagrams swim lanes org charts etc contracted candidate may also assigned fl fe cycle projects required business technology services bts project management office project assignment also depend candidate suitabity quafications location work main location work translink corporate head office nelson court new westminster british columbia canada near sapperton skytrain station secondary work locations include locations translink operating companies greater vancouver area required travel work locations metro vancouver area may required travel costs locations reimbursable transnk currently working within current covid restrictions imposed provincial medical health officer hours workthe contractor shall available work hour workday within translink standard business office hours pm note may requirement work additional hours ensure project successf hours paid normal rates lunch breaks reimbursable note part time engagement estimated days week average project duration start date immediatelyterm end date currently march st possibity extension subject funding approval contractor performance project description backgroundthe data conversion analyst primarily responsible definition design development implementation vadation maintenance business data conversions associated migration translink legacy finance asset management systems infor erp fsm eam appcations role member technology enablement team providing direct support migration infor erp role key hands contributor migration projects purpose project support data technical readiness technical enablement project within erp program data analyst technical focus translating data solution outputs finance supply chain requirements conceptual high level detailed technical one agile project fast pace evolving requirements implementation stage requires quick turnarounds solutions procedures toolsets project currently underway incumbent expected ramp become productive quickly successf candidate complement translink contingent staff contract project managers business technology services project management office pmo invited monthly pmo roundtable peer sharing meetings program consists several concurrent projects related implementation enterprise wide enterprise asset management supply chain financial system successf candidate data analyst translink technical enablement project servicestechnical enablement data analyst provide following services appropriate level detail determined project manager constation stakeholders successf candidate provide data analysis including testing developed packages specific services provided include mited following provides input extraction data legacy systems provides input data within data template data loads provides data analysis data cleansing data load processes provides input clarification data integration processes provides vadation test data integration processes provides input transformation infor load standardsdesign develop data models support execution system testingsupport execution user acceptance testing uat create deployment plans bi technology deverables support deployment bi technology deverables assist end user training data models reporting interfaces assist organization change management ocm activities required liaises business stakeholders supports data analysis contributes project plan required define business problem opportunities risks primary objectives related project initiative lead discussions stakeholder groups identify analyze requirements using variety techniques interviews document analysis requirements workshops surveys use cases scenarios workflow analysis evaluate information gathered mtiple sources reconcile confcts decompose high level information detailed functional technical specifications knowledge experiencediploma computer science recognized institute technology including courses database design programming systems analysis years data warehouse projects abity test ssis packages large data warehouse environment abity prepare analyze data excel sql knowledge experience microsoft bi technologies including ssis sql server database strong data analytical communication skills abity gather analyze consodate information variety data sources e documents interviews brainstorming sessions etc abity work collaboratively professionally effectively project team stakeholders end users desirable skills knowledge includedata model design reporting interface designdatabase performance tuningetl data warehousing development fecycle sql server environmentdata management data quatyexperience working hybrid agile scrum environmentexperience working unionized environmentexperience microsoft sharepointinfor knowledge experience asset deverablesnormal data analysis deverables supporting documentation expected although may modified suit scope scale project include limited followingcreate related documentation input project assistance uat documents testing plans assistance user training update conceptual subject area models current appcations data structures logical entity attribute level data models current data structures dataflow diagrams showing physical flow data current appcations detailed description point integration among appcations including source target mappings transformations performed list master data elements data dictionaries business glossaries data repositories included migration plan data profile qa data migrated requirements definition documents job,"New Westminster, British Columbia, Canada"
Data Analyst,wood mackenzie,nan,"Calgary, Alberta, Canada"
Business Intelligence Analyst,resolver kroll business,descriptionresolver operates hybrid workforce option work home office mix resolver looking business intelgence analyst help define develop deploy company wide data infrastructure integral part high achieving marketing team partner senior leadership define build data impacts business sounds important right think resolver resolver high growth saas company whose intuitive code platform gives customers clear picture risks make quick effective decisions part resolver team work help transform risk management risk intelgence organizations protect people assets dever purpose ambitious mission cture business within kroll offer innovative non hierarchical work environment blended stabity financial security enterprise resolver also named one canada great places work six years row really mean let hiring manager tell hi joe marketing analytics site optimization lead resolver leading team within marketing responsible website lead routing data resolver continues expand looking add business intelgence analyst help define develop deploy companywide data infrastructure partner senior leadership define build data impacts business future state data centric cture key stakeholders empowered self service data decision making work teams across resolver create dashboards provide data insights lot autonomy go require highly organized strategic want hear day day let break process design improvement understand stakeholder requirements anticipate future needs relates data data management design build optimize parts data warehouse infrastructure support analysis key data requirements gathering etl data modelng metric design reporting etc conjunction developers needed detect data quaty issues root causes implement fixes design data audits capture issues future explore new data sources provide usef insights inform company wide strategy andcollaborate key stakeholders necessary ision level reports across services product sales marketing ision leads data analysis serve ad hoc reporting agent isions resolver adjusting monthly reports updated data sources resolving issues current reporting requiredprovide new reporting dashboards visuazation business support growthproactively identify trends business insights improve rests core corporate kpis arr win rate back base revenuegenerate hypotheses cross functional data run experiments test efficacydata management write maintain documentation support goal data centric cture data integritydocument potential data sources resolver prioritize data sources make biggest impact business rests bring together one view ease management reporting tableauset standards key metrics avoid inconsistency reporting across dashboards teamsleverage key business objectives metrics setting reporting aim enabng teams dever exceed division level corporate level objectivesstrategy leverage data make short long term decisions optimize performanceregarly report executive team business impact bi infrastructure bi related projectcontinuously advance data cture researching market recommending industry best practices people excel background years experience software technology specific focus industries enterprise corporate buyers years data modelng data analysisexperience common bi tools e g tableau power bi looker domo data sources e g salesforce google analytics google ads extra bonus points love visuazationexperience data modelng designing etl processesyou love data fl stop next level able articate power data executives resolverites highly effective communicator problem solver put scuba gear e data lake navigate murky waters background analytics mathematics another quantitative field plusexperience python r snowflake plus give return resolver one canada great workplaces cture something write although values challenge best selves invest resolverites grow us health wellness benefits paid us health dental day one vision care every months also offer wellness fitness reimbursement go towards things ke gym memberships yoga classes soccer membership fees bike professional development external learning budget help grow develop host learning workshop every weeks topics ke time management self awareness giving feedback also e learning meet needs remote team offer career development program help identify build skillsets internal growth opportunities beyond also coaching program managers know important good boss invest development vacation open means worry accrual clock average see folks enjoying weeks year parental leave best class top new parents weeks new parents additional weeks pregnancy leave birth mothers flexibity trust remote enable team create work environment set success hire adts trust manage outcomes day day everyone given option decide whether want work remote office depending needs role back office choose come office back access snacks beverages office games ke switch chess ping pong offering lots opportunity team socials including folks remote interested want work highly collaborative environment committed making difference cck get process rolng try appreciate interest happily reply quafied candidates resolver committed providing accommodations persons disabities point recruitment process require accommodation please notify appcable recruiter contact us directly email protected,"Toronto, Ontario, Canada"
Data Analyst,empire life,data analyst new grad entry level new graduate seeking employment love working data empire fe looking hire driven iniduals passion data analytics mission make insurance investments group benefits simple fast easy customers help us reach goal joining team support lead meaningf change organization pursue opportunity accelerate career opportunity allows grow technical functional skills apply analytical lense opportunity digest data take analytical approach determining insights recommendations voice heard fresh perspective welcome highght opportunities improvement rapidly transforming business medium sized canadian company stable industry rapidly transforming working supporting key business teams estabsh key performance indicators providing analytical expertise recommendations best serve customers internal stakeholders following detailed processes prepare datasets complete analysisgenerating evaluating analyzing data reports ensure accuracy consistencydesigning analyzing data identify trends uncover solutions opportunitiescommunicating stakeholders new findings using visuazations means need mix skills developed via combination education experience data science analytics visuazation process design systems thinking digital development programming project management business analytics finance economicsor related work educational programsabity wilngness learnfast learning clear critical thinking skillseffective concise communicatoradditional asset binguasm engsh french beyond salary regar fl time positions empire life offers competitive salary comprehensive benefits package including flexible work environment mix remote office collaboration paid vacation personal daysbonus structurebenefits pension plansocial clublearning developmentcareer opportunities choicesget know us one top fe insurance companies canada offer environment encourages pursuit personal professional success heart success focus customers provide protection financial security canadians personal touch acknowledge reward talent support employees achieving exceeding inidual organizational goals goal make empire life great place work learn grow people true selves feel belong equal opportunity growth careers also committed supporting inclusive workplace values ersity looking exciting opportunity chance build career innovative dynamic organization submit resume ccking apply empire life committed providing equal access employment empire life welcomes encourages appcations people disabities accommodations available upon request candidates taking part aspects screening selection process need job posting alternative format please contact recruitment empire ca,Canada
Data Visualization Developer/Analyst,blue boat data,blue boat data looking data visuazation developer analyst position contract role strong kehood permanent candidate based canada united states bbd enterprise analytics saas company based new york city vancouver canada young company growing rapidly building next generation enterprise intelgence software leadership team combined years experience building managing data analytics digital marketing software across world leading brands felt continued significant gaps solutions solved problems faced users started blue boat data role design build interactive dashboards tableau power biperform document data analysis data vadation data mapping design work engineering team integrate new data sources optimize performance qualifications years hands experience designing interactive visuazations dashboards data visuazation products years data visuazation experience tableau power bi building scalable dashboards reportsexperience data processing large datasetssod technical knowledge relational database management systems sql programmingdesire work fast paced start environmentstrong verbal written communication skillscuriosity relentless desire learn,Canada
Data Analyst,libitzky property companies,using equity lpc continues build strengths reinvest capital new ventures roleyou responsible forcommunicating supporting use data architecture stakeholders development data architecture strategy governance providing secure stable scalable cost effective solutions facitate storage integration usage access devery data assets across business defining developing maintaining reports support decision making processing interpreting data get actionable insights working closely business users understand data analysis needs requirements ideal profileyou possess degree computer science apped mathematics engineering related field least year experience ideally within data analyst data architect role abity conceive data picture organisational perspective bridge gap current state future goals exposure expertise one emerging tools ke columnar nosql databases predictive analytics data visuazation unstructured data strong expertise data modelng database design good presentation communication skills abity present findings clearly accessibly form reports presentations senior colleagues strong networker relationship builderyou strong team player manage mtiple stakeholdersyou strong mentor coach build high performing teamswhat offer work alongside learn best class talentopportunity make positive impactgreat work environment,Canada
