title,company,description,location
Sr. Data Analyst,randstad canada,data analyst contract position number positions duration months initial contractlocation mississauga cawe currently looking quafied candidate assist finance analytics business intelgence team assist data engineering transformation data analyst work alongside data engineering information technology teams provide data related support data investigation sourcing data profing data analyst troubleshoot investigate data anomaes issues along working directly data engineers follow get root issues resolved person also assist building predictive systemsto help catch issues arise assist building support financial reporting great opportunity someone interested joining lean innovative group possibity tremendous career development data analysis beyond brand new position within finance insights analytics centre excellence looking someone worked retail environment brings experience data analysis merchandise retail use cases conduct data sourcing activities collect data sets various source systems thatwill staged google data lake facitate workshops various teams within identify source systeminformation data tables use data engineering tableau use casedevelopment conduct data profing document functional specifications use caseautomation development work data engineers build new data pipenes within google cloud services perform data vadation quaty assurance analysis new development develop maintain specific data development related documentation perform problem investigation data engineers reporting issuesrequired skills abity organize lead meetings business operational teams coordinate communicate business users data engineering teams andtableau bi development teams abity troubleshoot assist data engineers resolution data related issues abity construct document data models provide data design ideas communicate present technical information non technical team members andstakeholders abity independently manage mtiple priorities proactively service mtipleinternal cents fast paced environment abity review access provide detailed information daily independentthinker excellent communication skills including written verbal presentation looking bachelor degree college diploma equivalent experience data analysis dataquaty master data development technology related field years experience working technical related role data analyst datascience data quaty master data management experience working retail enterprise corporate financial information experience working retail enterprise retail information experience working bi reporting teams determine ffil datarequirements abity determine document data flows experience working documenting data mapping data warehouse tableinformation experience working cloud data projects experience working within large company sourcing data set data warehouseactivities,"Mississauga, Ontario, Canada"
"Sector Data Analyst, Data Driven Investing",cpp investments investissements rpc,company descriptionmake impact global dynamic investment organizationwhen invest career cpp investments join one respected fastest growing institutional investors world current assets management valued excess bilon cpp investments professional investment management organization globally invests funds canada pension plan cpp help ensure long term sustainabity cpp fund projected reach trilon cpp investments invests major asset classes including pubc equity private equity real estate infrastructure fixed income instruments headquartered toronto offices hong kong london luxembourg mumbai new york city san francisco pao sydney cpp investments attracts selects high cabre iniduals top tier institutions around globe join team look forward diverse inspiring colleagues approachable leadersstimating work fast paced intellectually challenging environmentaccelerated exposure responsibityglobal career development opportunitiesbeing motivated every day cpp investments important social purpose unshakable principlesa deeply rooted cture integrity partnership high performanceif share passion performance value collegial collaborative cture approach everything highest integrity opportunity invest career cpp investments job descriptionthe investment research team within active equities responsible conducting data driven investment research implementing investment strategies leveraging research currently seeking driven intellectually curious iniduals want part growing passionate team developing industry leading approaches discretionary investment research recruiting sector data analyst develop insights analyzing alternative data goal help make better investment decisions generating novel insights companies leveraging alternative data role specific accountabitiesact sector data domain expert becoming deeply famiar industry datasets including conducting trials building research products conducting bespoke researchwork closely investment teams understanding kpi industry companies interestdevelop novel insights core datasets maintain datasets associated forecasts key data ownerwork closely investment teams analysing key research questions sourcing analyzing relevant data best answer questionsproactively seeks ways advance investment research sourcing new data analyticsquaficationsadvanced degree statistics economics computer science mathematics engineering quantitative field preferred least years apped experiencestrong research analytical problem solving skills abity think creativelyproficiency one programming languages python pandas r sql proficient working datasets api conduct researchexperience analyzing large datasetsmust highly industrious motivated dever restsdetail oriented abity produce high quaty workabity work entrepreneurial environment self starteradditional informationvisit linkedin career page follow us linkedin cpp investments committed ersity equitable access employment opportunities based abity thank appcants interest contact candidates selected advance hiring process commitment inclusion diversity addition dedicated building workforce reflects erse talent committed fostering inclusive accessible experience require accommodation part recruitment process including alternate formats materials accessible meeting rooms etc please let us know work meet needs disclaimer cpp investments accept resumes employment placement agencies head hunters recruitment suppers formal contractual arrangement us recruitment supper arrangements restricted specific hiring needs include web site job postings resume information received supper approved cpp investments provide resumes posting web site considered unsocited considered cpp investments pay referral placement fee supply unsocited resumes information mandatory vaccine pocyall employees toronto new york san francisco mumbai sydney sao pao offices required vaccinated covid accommodations pocy made medical protected grounds please contact us discuss accommodation needs,"Toronto, Ontario, Canada"
Data Analyst,circle k,join teamour mission simple make journeys easier enjoyable customers want ft spirits devering ttle boosts along way care people communities look ways upft people first wherever journey going help get business data analystdepartment creative production teamlocation laval qc toronto calgary abtype permanent fl timehybrid mode days office days remotelythe rolebased within global creative production team business data analyst responsible building implementing data analytical reports stakeholders include monthly kpis dashboards excel reporting person turns data points actionable business insights helping us spot track trends helping us forecast advise best practice reporting senior project manager responsible day day couche tard circle k reporting gathering data design processes curating variety audiences confident analytical skills able communication findings internal customers got experience working data want work within fast paced creative team love hear looking afterhere want help create clear business insights stakeholders responsible design implementation dashboards reports performance analysis monthly ad hoc reporting performance kpis use data modeng techniques identify ways operate effectively support advise innovation rollout new technologies processes drive performance document new processes ensure correct business controls place encourage actively engage collaboration communication teams find synergies build knowledge networks systems within organization contribute stakeholder training rollout support new system processes needhere looking experienceminimum years experience data analysis business analysis project management similar role strong skills collaboration cooperation communication organising experience working high volumes data across mtiple systems extracting cleaning exploration data experienced relevant microsoft business suite software industry programs eg sql excel power bi strong track record producing detailed reports dashboards easily executable management teams strong communication skills engsh verbally written need able communicate findings teams actionable rests educationhigher relevant education years experience equivalent additional relevant education plus fluent engsh oral written french beneficial personality profile relating networking persuading influencing creating innovating planning organising devering rests meeting customer expectations adapting responding change entrepreneurial commercial thinking team principlescustomer focused identifies understands customer needs puts first activities efforts commercial mindset goes extra mile drive commercial success company continuous improvement courageously moves company forward today future retail cooperation supportive positive team player committed company decisions making us succeed together personal integrity promotes ves company standard ethics openness values strategic execution understands drives company strategy organization marketplace work ushere exciting perks offerour store office employment opportunities offer quick career growth international company plus dynamic work environment puts people first wherever journey place complete benefits packages medical dental etc possibity enrolng pension plan employer contributions stock purchase plan employee discounts stores mtiple partners paid time plan including vacation sick days personal days work collaborative dynamic high performing team learning opportunities develop new skills evolve professionally fast growing company hybrid work interested send us resume email candidatglobal couche tard com following position number subject ne internal candidate apply via workdaycouche tard circle k places great importance ersity workplace committed principle employment equity encouraging appcations designated groups e women aboriginal people people disabities visible minorities must egible work canada order apply position thank candidates interest position selected contacted couche tard circle k values ersity inclusion aims create safe accessible rewarding workplace showcases unique contribution employees success business employer committed employment equity encourage wide variety appcations ensure erse workforce representative customers communities serve accommodations available upon request appcants participate aspects selection process r,"Toronto, Ontario, Canada"
Data Administrator/Data Analyst,hays,new company leading oil gas midstream cent mtiple offices across canada looking onboard data analyst year contract position based calgary new role supporting stabshed procedures conduct data entry work company legal registry monitoring process gathering information data various areas company assisting direct supervision entry legal registry system working routine business processes assisting business technical professionals variety business areas need succeed excel word skills asset strong organizational project management skills need available interested role please apply send updated resume,"Calgary, Alberta, Canada"
Commercial Data Analyst,organigram inc,position summary reporting director consumer insights dotted reporting ne senior manager business analytics intelgence reporting commercial data analyst leverage growing data sources create comprehensive analytic reports unlock improved business performance main responsibities manage organigram internal sales databases produce insights third party datasets tools coordinate consumer research projects well create actionable insights commercial sales marketing product function hybrid role expectation office minimum days week either organigram toronto location moncton office key responsibities develop maintain organize market intelgence reports provide clear insight performance cannabis market brands highght historical future trends support development maintenance hostic reporting dashboards service additional ad hoc dashboarding needs identify investigate data analytics related issues responsible monitoring accuracy vendor data provide analytical support sales marketing product teams using consumer insights drive growth proactively seek investigate new technologies tools advance analytics practice participate market research brief project coordination external internal stakeholders work partnership various functions provide day day support devery analytics execute data requests accurately within timely manner coordinate stakeholders meeting innovation sales marketing teams agenda minutes quafications post secondary degree business information management related field study years experience data analyst reporting analyst equivalent role strong business acumen strong communication skills written verbal excellent attention data abity manage tight deadnes proven track record turning data insights insights action experience within cpg fmcg beverage alcohol cannabis industry considered strong asset abity think outside box use initiative take ownership work proficient ms excel powerbi thank interest organigram time wish advise appcants one component organigram occupational health safety program developed response covid pandemic specifically keeping terms organigram covid vaccination pocy employee offer extended subject precondition offeree provide proof fly vaccinated covid using one doses required vaccines approved appcable pubc health agencies jurisdiction employed orthey legally entitled exemption vaccination pocy law respective jurisdiction,"Toronto, Ontario, Canada"
Data Analyst,vector institute,position overviewthe vector institute seeking data analyst join growing team toronto nested research operations academic partnerships team reporting manager talent initiatives data analyst key contributor team objectives supporting data capture reporting metrics web scraping workflows related research operations academic partnerships work stream key responsibities lead mapping analysis enhancement workflows current data processes research operations academic partnerships work stream support transition existing databases salesforce platform work closely various work streams develop implement strategies data collection related students researchers employment outcomes maximize data integrity efficiency analysis maintain analyze visuaze data insights research operations academic partnerships work stream including graduate outcome data employer engagement data hiring outcome data researcher data data related vector digital talent hub assist ffilng periodic metric requirements external stakeholders enhance data workflows automation opportunities reduce manual efforts increase data accuracy cleanness develop automated dashboards enhanced accessibity timeness data reporting conjunction technical team members monitor maintain enhance automated web data scrapers feed data vector operations related duties assigned profile ideal candidatetechnical skills strong proficiency excel gsheets including macros experience workflows reporting functionaty dashboards salesforce strong proficiency visuazation tools ke google data studio tableau power bi vector currently uses google data studio intermediate proficiency python programming language famiarity general programming concepts basic proficiency database programming languages ke sql proficiency scrapy framework python beautifsoup github actions plus proficiency web automation tools ke zapier plus skills years experience data analysis visuazation including use related tools noted years experience data workflows related automations able take potentially dirty dataset convert usef insightf data using automated methods data cleaning famiarity academic data plus action oriented demonstrated abity take direction turn actionable rests creative enjoy collaborating within small entrepreneurial environment rests driven,"Toronto, Ontario, Canada"
Data Analyst,gsl group,innovate tenacity empower get things done unique fun gsl group includes wide range businesses including real estate development holdings construction commercial industrial residential sports entertainment facities e commerce onne gaming sports betting fantasy sports sports entertainment travel hospitaty food beverage agricture looking fl time experienced data analyst utize technology background expertise support product sales marketing leadership teams insights gained analyzing company external data essentially help us organize data build appropriate structure provide insights nk data various sources enable us make quantified business product decisions based vancouver team option work head office vancouver remotely anywhere bc got attention yet good let get details day life collect analyze interpret report data meet business needs developing implementing data analyses data collection systems strategies optimize statistical efficiency quatygenerate ad hoc business insights reports needed internal stakeholdersautomate generation recurring reportsidentify analyze interpret trends patterns complex data setsfilter clean data ensure consistency analysis reportingwork management prioritize business information needslocate define new process improvement opportunitieswork stakeholders throughout organization identify opportunities leveraging company external data drive business solutionsassess effectiveness accuracy new data sources data gathering techniquescoordinate different functional teams implement models monitor outcomesyou bs ms computer science computer engineering statistics related field years experience similar roleknowledge data management visuazation techniquesa knack statistical analysis predictive modengproven experience deploying machine learning models cloud preferably awsexpertise microsoft excel power biexperience sql nosql databases strong analytical problem solving skillsproven working experience data analyst business data analysttechnical expertise regarding data models database design development data mining segmentation techniques r analyticsstrong knowledge experience reporting packages business objects etc databases sql etc programming xml javascript etl frameworks knowledge statistics experience using statistical packages analyzing datasets excel spss sas etc strong analytical skills abity collect organize analyze disseminate significant amounts information attention detail accuracyideal candidate strong experience using variety data mining data analysis methodsis comfortable ambiguity change enjoys working self directed entrepreneurial work environment self motivated detail oriented rests drivenpositive outlook curious desire learn growworks sense urgencyexcellent written verbal communication skillsperks benefits cool stuff flexible schedework home availablecompetitive salaryemployer paid dental extended health coveragelife insurance disabity coverageemployee family assistance program efap employee discount programsfront line access shows concert ticketsemployee family assistance programnew hire referral bonusesgsl scholarship programgsl proud equal opportunity employer value ersity dedicated providing work environment free harassment discrimination employment decisions made based quafications job requirements business needs gsl passionate known inclusive cture talented people backgrounds want work,"Vancouver, British Columbia, Canada"
Commercial Data Analyst,organigram inc,nan,"Toronto, Ontario, Canada"
Data Engineer 1,four seasons hotels resorts,four seasons hotels resorts global luxury hotel management company manage hotels resorts private residences countries around world growing four seasons powered people cture enables everything central four seasons employee experience social impact programming company commitment supporting cancer research advancement ersity inclusion equaty belonging four seasons corporate offices properties worldwide four seasons powered people cture enables everything azure data engineer technical leader data analytics commercial data engineering team responsibities include design build optimization maintenance experiments prototypes products across four seasons microsoft azure data platform including databricks azure engineer use modern innovative technology help business partners reaze actionable insights value four seasons enterprise data platforms includes mited design build data extraction transformation loading processes developing custom data pipenes engineer valued member internal data engineering capabity working together discover define requirements use cases outcomes member devery team engineer build configure secure migrate optimize refactor azure data platform solutions includes ingestion etl elt storage data lakes delta lakes data warehouses lakehouses data modelngthe candidate capable working levels organization abity understand translate institutional knowledge technical solutions strong service communication problem solving skills key role based four seasons hotels resorts toronto corporate office reporting senior director data engineering role involves interactions internal executive stakeholders project sponsors technical operations development teams four seasons end user contracts product users externally role interact various four seasons partners data solution providers microsoft source data providers key activitiesdata engineering design develop test efficient batch processing xlt processes using microsoft azure databricks delta lakedesign optimize pyspark python code must able write usable production level codedesign optimize sql syntax queries faster data processingdimensional modelng experience mandatorydesign develop tabar models aas power biadoption best development practices batch processingmanaging work jira including mited story creation defect resolution etcdocumentation work confluenceidentifies opportunities new architectural initiatives makes recommendations increasing scalabity robustness platforms solutions desired skillsexcellent analytical mathematical creative problem solving skills excellent stening interpersonal written oral communication skills logical efficient keen attention detail self motivated directed abity effectively prioritize execute tasks pressure able exercise independent judgement take action strong customer service orientation experience working team oriented collaborative environment abity lead technical teams outage technical roadblock situations abity prioritize competing requests resource abity translate business needs data requirements priorities abity devise apply logical steps troubleshoot issues test new development abity engage role mtiple angles trainer helpdesk support person tester analyst process oriented capabity skills proven experience providing excellent customer service internal system users demonstrated time task project management skills including planning organizing managing resources abity work several un related projects concurrently technical skillsdata engineering microsoft azure environment toolsets adla adf synapse data bricks aas cosmos db functionapps logic apps etc expert knowledge sqlskilled core data warehousing platformsprogramming skills python scala etc microsoft power bi devery supportmicrosoft power suite devery supportazure ai ml skills devery strong sql query skillsstrong history python c scala javadata process improvementworking large data setsconfluence jira testrailhelpdesk tools methodsmicrosoft visiomicrosoft office suite strong excelexperience education professional quaficationsuniversity higher degree engineering mathematics information systems computer science technologycompletion azure fundamentals azure data engineer certificationscompletion azure ai fundamentals azure ai engineer certifications years experience data engineering visuazation analytics azure environments years experience ai ml projects implementationsminimum year experience azure databricks delta lake azure data lake synapse analytics azure data factory function apps analysis services power bigood understanding basic concepts data warehousingall internal appcations must submitted approved workday september role hybrid working model require days per week four seasons corporate office located lese street toronto ontariofour seasons committed providing employment accommodation accordance ontario human rights code accessibity ontarians disabities act contacted employment opportunity please advise human resources require accommodation,"Toronto, Ontario, Canada"
