title,company,description,location
BI Reporting Analyst,trade x,trade x looking bi reporting analyst ready take unique opportunity join top tier cutting edge global company play key role executing strategic vision looking exhaustive working key business users understand current business problems identify reporting opportunities document business intelgence requirements different business needs document business res vadate data mappings perform impact analysis support related teams investigation design business solutions collaborate selection best solutions present vadate business partners alternative proposed solution must understand different operational systems systems functioning engineering concept contain understanding available data investigating data etc must show strong adaptabity discuss expertise training hierarchy different stakeholders handle support requests related reporting providing sound innovative practicable solutions work closely data teams understand data models availabity integrity analyze required data sources health data pertains reporting solution communicate business needs teams responsible development design propose solutions providing timely status updates work requests issues concerns work autonomously accountable acting lead within speciazed business management function manage reporting tool looking least years relevant experience business intelgence projects reporting dashboard building excellent communication know manage time mtiple projects simtaneously demonstrate highly developed analytical skills rigorous quaty conscious work efficiently team setting expert sql excel visuazation software tableau toucan etc knowledge data extraction manipation cloud data redshift neptune experience presenting ideas products concept papers varied audiences experience coaching business stakeholders navigating bi dashboards experience automotive industry wod asset offer competitive salary benefits focus work fe balance challenging work never stop innovating work never done across teams roles every employee empowered bring best ideas forward jump solve problems passionate great people every person valued plays important role shared successglobal impact global team spanning continents boundaries ctures every day inspired impact work colleagues customers communities world large diversity equity inclusion diversity equity inclusion words us guiding principles building cture celebrate others differences continuously strive equaty recognize inclusion makes us stronger iniduals company global citizen rewarding work fast paced creative environment colleagues passionate automotive industry chance grow within organization trade x proud equal employment opportunity affirmative action employer discriminate based upon race region color national origin gender including pregnancy childbirth related medical conditions sexual orientation gender identity gender expression age status protected veteran status inidual disabity appcable legally protected characteristics committed fostering inclusive accessible environment employees feel valued respected supported candidates whose backgrounds closely match requested skills desired attributes outned announcement invited interview thank considering trade x job detailsemploymentfl timejob functionbi reporting analystindustryautomotive export tradejob id,Canada
Senior BI Analyst,telecon,relevant du chef quipe intelgence affaires vous participeriez la mise en place et la gestion de contr les de curit en suivant les bonnes pratiques telles que nist ou iso k dans un de maintenir un bas niveau tous les risques auxquels l entreprise fait face tous les domaines autour de la curit et de conformit pourraient tre abord responsabilit sentretenir de bonnes relations avec nos cents internes en adoptant une posture conseil concevoir et mettre en place des solutions analyse de donn es et de production de rapports l chelle de l entreprise proc der l examen et l analyse de donn es provenant de mtiples sources internes et externes examiner et vader des donn es collaborer troitement avec l quipe int gration de syst et les quipes op rationnelles pour l analyse et veloppement des solutions int gration des fins analytiques r aser et maintenir des rapports et tableaux de bord dans power bi travers des visuasations impactantes un mod le de donn es pertinent et une automatisation robuste exigencesexp rience minimale de ans dans un poste similaire tenir un dipl tudes sup rieur dans un domaine pertinent intelgence affaires commerce lectronique marketing etc trise au moins un langage de programmation associ l analyse de donn es ainsi que le langage sql exp rience avec ssis et ou ssas est un atout trise de powerbi conception visuelle dax et powerquery trise un outil quivalent tableau qk est un atoutbingue fran ais et anglais aptitude adopter une posture de conseiller et de propositions vis vis de ses cents internes aptitude travailler en quipe propos du groupe teleconfond e en telecon est le plus grand fournisseur de services en infrastructure de r seaux de l communications au canada la soci appuie sur sa pr sence nationale ses milers de professionnels quafi ses relations cents et ses plus de ans existence pour offrir des solutions de conception de locasation infrastructure et de connectivit de pointe aux entreprises de l communications et entreprises centes l chelle du pays selon la r gion et le type de travaux effectuer telecon affiche sous l une ou l autre de ces marques telecon telecon design agir constants promark telecon expercom chemco telecon infrastructure telecon entreprises marcomm plexus unified systems group sc questzones et trj telecom pour plus de renseignements sur telecon visitez telecon com nous vous remercions de votre int r mais nous communiquerons seement avec les candidats lectionn pour une entrevues l usage du mascun pour unique ger le texte reporting team lead business intelgence wod participate implementation management security controls following best practices nist iso k effort keep risks facing company low areas around security compance cod addressed responsibilitiesmaintain good relations internal cents adopting advisory stance design implement enterprise wide data analytics reporting solutions review analyze data mtiple internal external sources review vadate data work closely system integration team operational teams analysis development integration solutions analytical purposes reaze maintain reports dashboards power bi impactf visuazations relevant data model robust automation requirementsminimum experience years similar position hold graduate degree relevant field business intelgence e commerce marketing etc proficiency least one programming language associated data analysis well sql experience ssis ssas asset mastery powerbi visual design dax powerquery mastery equivalent tool tableau qk asset bingual french engsh abity adopt advisory posture proposals vis vis internal cents abity work team telecon groupfounded telecon canada leading telecommunication network infrastructure services provider company leverages national presence thousands skilled professionals cent relationships year history offer industry leading design locate infrastructure connectivity solutions telecommunication companies corporate cents nationwide depending region type work performed telecon operates one following brands telecon telecon design agir constants promark telecon expercom chemco telecon infrastructure telecon entreprises marcomm plexus unified systems group sc questzones trj telecom information telecon visit telecon comwe thank appcants interest however candidates selected interviews contacted li hybrid,"Montreal, Quebec, Canada"
Senior Analytics Engineer (Remote),jungle scout,jungle scout mission empower entrepreneurs brands grow successf e commerce businesses provide industry leading data powerf tools resources need want work one biggest ecommerce datasets world get excited extracting insights tbs data want help build sophisticated data driven products ecommerce industry passionate building tools immediate impact customers amazing type person looking rolewe looking add senior analytics engineer fast paced customer oriented r team senior analytics engineer build reporting systems perform analysis support enterprise group identifying opportunities improve customer facing data products measure impact initiatives location remote first company looking hire person anywhere pst est timezone interested learning let get details senior analytics engineer role design create dashboards reports clearly convey progress important goalscollaborate product data science data engineering teams identify define track key metrics used monitoring measuring success data productsidentify data needed key metrics work engineering teams instrument systems ensure availabity dataperform deep analysis understand trends opportunities data products recommend actions improve themwork data variety sources perform analysis build dimensional models business processesmaintain data documentation definitionswho strong sql skillsstrong python skillsexperience etl design data modeng implementation maintenanceexperience extracting data various systems e g relational databases api endpoints data lakes data warehouses tying business meaningabity perform basic statistical analysis inform business decisionsproven abity succeed collaborative independent work environmentshigh degree ownership ambiguous analytical tasksstrong communication skills written verbalexperience working data science teamsexperience aws azure gcp etc working jungle scout best team remote first cture international meetups access jungle scout tools experts performance bonus flexible vacation comprehensive health benefits retirement program jungle scoutjungle scout leading one platform selng amazon supporting bilon annual amazon revenue founded first amazon product research tool jungle scout today features fl suite best class business management solutions powerf market intelgence resources help entrepreneurs brands manage e commerce businesses jungle scout headquartered austin texas supports global amazon marketplaces jungle scout team group smart motivated fun loving professionals working hard help customers achieve success remote first cture employees across world well hub offices austin tx vancouver bc shenzhen china beeve team members shod opportunity choose work environment works best give team members option working home one hub offices co working space offer workplace flexibity competitive compensation packages k rrsp matching generous vacation professional development help thrive career entire jungle scout team also gathers annual expenses paid retreats past locations included ba bangkok vietnam budapest mexico colombia costa rica check us prioritize diversity equity inclusion jungle scout hire great people wide variety backgrounds right thing makes company stronger jungle scout committed creating erse environment proud equal opportunity employer quafied appcants receive consideration employment without regard race color region gender gender identity expression sexual orientation national origin genetics disabity age veteran status offers employment jungle scout contingent upon clear rests comprehensive background check background checks conducted final candidates prior start date,"Vancouver, British Columbia, Canada"
Senior Data and Reporting Analyst,american iron metal aim,company descriptionbecome part aim growing success american iron metal aim recognized global leader metal recycng industry site locations employees worldwide continued prosper last eight decades celebrated th birthday thanks dedication employees ongoing trust support customers become part team aim growing team years successfly evolved mtifaceted company business isions include metal recycng aim recycng construction waste recycng aim eco centre manufacturing solder assembes aim solder demotion decommissioning aim delsan auto recycng kenny u pl take pride good things environment help create greener sustainable future simple right aim excellence offer competitive salary perks group insurance rrsp program company wide events throughout year bbq hoday party etc free gym site two cafeterias site subsidized meal program available dynamic rewarding work environment work high impact meaningf projects also fun job descriptionparticipate preparation consodated rests including compance reports monthly quarterly basis build maintain reports models various reporting tools support building process documentation key processes financial reporting provide automation solutions evaluates existing business processes assess current efficiency efficacy internal controls participate ongoing reviews existing business processes development optimization strategies related business cases considering costs savings issues risks benefits proposed solutions support implementation management enterprise performance management tool epm performs data analysis using excel sql server power bi tools build scalable reusable interactive power bi dashboards leveraging best practices dax involved annual external audit process preparation external financial statements verify consodated rests compance credit facity financial covenants baskets handng various ad hoc tasks including requests various corporate departments quaficationslet talk bachelor degree accounting finance minimum three years relevant experience data analytics financial reporting working part large complex organization mtiple isions locations proven experience querying organizing analyzing data sql debugging sql queries proficiency bi tools excel power bi microsoft erp experience leveraging data crm erp systems good knowledge ms office appcations excel powerpoint word abity work concurrently across mtiple technologies excellent analytic skills team player bingual engsh french written oral conscientious organized strong problem solving skills capable prioritizing mtiple projects still achieving deadnes strong excel skills including advanced formas macros additional informationthe american iron metal company subsidiaries offer equal employment opportunities mascune gender used ghten text selected interview contacted,"Montral-Est, Quebec, Canada"
Data Engineer,medme health yc w,hello michael https www nkedin com michael barajas joined medme year director engineering stranger scang healthcare technology companies thrilled leading growing dynamic impact driven team engineer heart thrive building modern cloud based appcations help make healthcare better everyone looking data engineer join growing team get chance build modern patient care management platform aws using cloud native technology vision product medme already disrupted legacy platforms pharmacy care devery wod love join us excelng impact within healthcare system co founders purya nick rui https www youtube com watch v vxvkfnk sg built medme together identifying biggest problem existing pharmacy software built years ago primary purpose sell drugs purya https www nkedin com purya originalsubdomain ca health data scientist government nick https www nkedin com nihui product engineer tesla roadster rui https www nkedin com surui originalsubdomain ca pharmacist team equally passionate using pharmacists provide services patients community building software industry reed paper pen long time crafting building constantly improving end end customer experience essential part company crucial sten deeply erse needs pharmacies located anywhere dense urban jungles northern remote communities design build needs timately provide proactive sustainable care patients communities mission medme building operating system transform pharmacies community health hubs pharmacies increasingly selng drugs offering services ke vaccinations prescribing meds blood tests medme health builds software helps schede document manage services scale cents include two largest pharmacy chains canada servicing coast coast pharmacies across provinces serving milons patients opportunity building new real time streaming data warehouse using aws native infrastructurecollaborating key technology decisions shape architecture product roadmapdocumenting data model making presentable enterprise customers ingest operate againstsharing depth breadth knowledge peer mentorshiptaking active role developing etl streaming processes code reviews sprint planning retrospectivesbuilding ci cd pipenes automating workflows using githubworking code project management tools jira notion githubkeeping date industry best practices hipaa soc environmentwork engineering staff help resolve technical challenges build best class solutionsdeploy repeatable aws architecture using infrastructure code aws cdk tech stack aws glue kinesis kinesis data analyticspython apache kafkapostgres dynamodbaws infrastructure terraform aws cdk preferred github github actions automate daily tasksfamiarity cognito cloudwatch plusslack giphy tenor gif game strong example projects cod expect work unifying mti tenant database single source truth operational data medmecreating ideal schema cdc process third parties ingest milons changes per day peak timescreate event based model push updates third parties including emrs data warehousesrefactoring existing schemas improve performance reusabitycreate robust ving document define data interface definition external customers data analytics staffworking healthcare iot manufacturers ingest data scale bring table experienced fl stack engineer years experience beeve years experience however typical senior member team years team player enjoy working fellow team members work ideas problems growth mindset seek opportunities grow communication style open concise effective easily explain technical non technical parties care product end user process builder enjoy working engineers ready help improve processes make scalable sweat everything sted beeve growth curiosity quaties excited opportunity want hear hire medme committed fair equitable hiring process candidates ensure candidate journey consistent selection process unbiased team medme responding personal messages regarding role opportunities interview process round phone screen member teamround virtual minute technical interview michael director engineeringround virtual minute coding challenge review michael director engineeringround virtual minute co foundersround conduct referencesround offer following advice canadian health authorities mitigate risk potential spread covid support social distancing recruiting activities including interviews new hire boarding conducted virtually annual salary ranges cad stock options perks medme flexible health benefit planfl dental vision physical mental health plus health spending accountperformance development support yearly budget courses conferences location fly remote canada however ke plan site team retreats medme proud equal opportunity workplace committed equal employment opportunity regardless race color ancestry region sex national origin sexual orientation age citizenship marital status disabity gender identity veteran status looking motivated compassionate people execute ground support work medme beeves medme committed developing inclusive barrier free recruitment process work environment shod require accommodation please inform us work meet accessibity needs accessibity related assistance requests information accessible alternative formats report accessibity problems please share appcation,Canada
Data Analyst / Consultant (Fire / EMS),darkhorse analytics,dodarkhorse analytics edmonton based consting firm speciazing predictive analytics data visuazation visuazation team internationally recognized building custom interactive visuazations focus impact clarity company first began darkhorse emergency darkhorse emergency provides software custom analytics fire ems poce services make data driven decisions better serve communities began loose collection excel spreadsheets ph thesis matlab code evolved ecosystem database driven web apps best practices work cents provide bespoke software advisory services every cent different interpretation data unique needs requires strong analytical skills doingwork darkhorse emergency erse ever changing implement proprietary software solve interesting challenging business problems wide variety fire emergency cents work understand cents data bring proprietary software provide depth analysis highghts root causes opportunities work team analysts take part project fe cycle start finish including gathering interpreting fire ems data data come different sources including cent tools open databases well flat files bringing data together databases big part data cleaning summary analysis data rarely want cleaning understanding inputs first required step quantitative project implementing darkhorse emergency platform matching cents unique data fields required platform crucial step requires business context well technical savvy vadating findings stories data findings pass smell check mix experience expertise creativity required vadate findings distinguish right signals data errors creating stunning data visuazations using tools ke qgis jupyter notebooks even excel work data create visually engaging visuazations maps clarify findings creating succinct presentations reports often times analyses need translated report readable actionable going collect dust shelf beeve less take time make succinct translating cent needs achievable solutions using understanding industry cent unique challenges provide cents actionable recommendations understanding cents means confidently approach business problems brainstorming creative approaches theory practice never agn creativity must planning solution improving tools processes growing company must continually search better way expect spend good portion time improving processes look forwe beeve right person defined years experience education look right people levels career things make stand wizard data comfortable using combination excel sql python ideally experience using gis tools ke qgis visuaze data geographically ideally experience fire emergency management industry famiar municipal datasets city planning land use zoning etc strong desire learn also acceptable genuinely enjoy problem solving finding patterns harder challenge harder put crack intrigued career consting data analysis beeve constantly pushed comfort zone thrilng opportunity able focus critical parts haystack data able find needle pinpoint issues root causes communicate well correct analytical solution one thing shod also able develop solution methodically explain whole thing grandmother end motivated comfortable immersing data understanding message behind skeptical findings seem correct detail oriented see big picture creative ways interpreting analyzing data one avenue leads dead end use different data sources come outcome satisfies business need share valueswhat offercompetitive salaries within transparent salary environmentcompetitive benefits profit sharing programunmited vacation plus summer shutdown flexible working conditions remote person edmontonunmited career opportunities high growth companythe abity make impact work matterswe look forward hearing,"Edmonton, Alberta, Canada"
